JobTitle,Company,Location,PostDate,Summary,JobUrl
LMS Administrator,Spirit Airlines,"Miramar, FL",2 days ago,"Collaborate with Scheduling & Records, Content developers, LMS & SETS Vendors, & Instructors to setup, operate, maintain, and administer usage & analysis of LMS…",https://www.indeed.com/rc/clk?jk=90cbb6da59a1bade&fccid=a78a760af11ad436&vjs=3
"Full Stack Developer, Junior",Booz Allen Hamilton,"Washington, DC",10 days ago,"Experience with working in full stack development, including front-end, back-end, database, and DevOps. We’re looking for a developer with the skills needed to…",https://www.indeed.com/rc/clk?jk=268b3075d7e4c8c6&fccid=4e041af1d0af1bc8&vjs=3
Full Stack Developer,Instrument,"New York, NY",30+ days ago,"Grasp the implications of back-end API integrations, and can effectively cross between front-end and back-end development.",https://www.indeed.com/rc/clk?jk=46960be916b2ce98&fccid=39e9814c7cebaf41&vjs=3
Application Developer,Crema,"Kansas City, MO",15 days ago,"At Crema, products are built by small, autonomous, cross-functional teams. Develop new user-facing features using tools like TypeScript, React, ReactNative,…",https://www.indeed.com/rc/clk?jk=a45e7208cbc3e2bc&fccid=f1c02157fe37f743&vjs=3
"Director, End-to-End Security__",Cisco Systems,"San Jose, CA",22 days ago,"Deep domain and/or proven experience and expertise in transforming security operations for Enterprise customers, with knowledge or prior experience in…",https://www.indeed.com/rc/clk?jk=1cb7d6fb53b2afb8&fccid=dfc44f3b8c44a6db&vjs=3
"Director, Quality Engineering",S&P Global,"Springfield, IL",30+ days ago,"Develop and implement quality test infrastructure across multiple channels including web, mobile, service layers, back-end, and integration.",https://www.indeed.com/rc/clk?jk=f04352d55696a2d4&fccid=b716e44d2c6283e7&vjs=3
"Web Developer, Front-end (Web Designer/Developer)",Indiana University,"Bloomington, IN",30+ days ago,"Act as a liaison between design/creative teams, back-end web developers, and stakeholders to ensure optimal functionality, performance, scalability, and…",https://www.indeed.com/rc/clk?jk=3a357470e3cc389b&fccid=8b8af8e5cb513470&vjs=3
Word Press Developer,Oozle Media,"Sandy, UT",30+ days ago,You will need to be able to slice a PSD into a fully-functioning website using a blank template (without tweaking existing WordPress templates).,https://www.indeed.com/rc/clk?jk=ae5c04c34cd8d98d&fccid=1e99f7666fda15e0&vjs=3
Developer (Full Stack) - Senior,Bayer,"Chicago, IL",8 days ago,"10+ years hands-on experience developing robust back-end services and platforms. Plan, lead and guide improvements and architecture in key discipline areas and…",https://www.indeed.com/rc/clk?jk=4a7cb092dc6d644c&fccid=e08122e0e993cc32&vjs=3
PYTHON DEVELOPER,Bangura Solutions,Remote,23 days ago,Developing back-end components to improve model responsiveness and performance. Familiarity with front-end technologies (such JavaScript and HTML5).,https://www.indeed.com/rc/clk?jk=aea4c535ed6cf391&fccid=f53fad3b59883186&vjs=3
"Back End Developer (Raleigh/Durham, NC)",IBM,"Research Triangle Park, NC",14 days ago,"Software Developers at IBM are the backbone of our strategic initiatives to design, code, test, and provide industry-leading solutions that make the world run…",https://www.indeed.com/rc/clk?jk=d9e95bd53c38fdfa&fccid=de71a49b535e21cb&vjs=3
Python (Django/Flask) Developer,Trood,"New York, NY",30+ days ago,"Professional knowledge of Python, Django, or Flask. High professional motivation and ambition. Knowledge and experience in the application of design patterns,…",https://www.indeed.com/rc/clk?jk=a5fe3ba2a2ecdbe2&fccid=dd616958bd9ddc12&vjs=3
Sr. Front End Developer,commercetools,"Durham, NC",30+ days ago,Work in an organization split up into vertical teams allowing code and problem domain ownership. Collaborate with our Designers (UI/UX) and Product Owners to…,https://www.indeed.com/rc/clk?jk=68088f9420e3eebe&fccid=9bc1a9122a7a12e3&vjs=3
"Junior Angular, CSS/HTML5, ASP .NET, C#, SQL, DNN Developer Team Member","Rock Solid Software, LLC","Raleigh, NC",30+ days ago,Design and develop back end Microsoft C# logic under the direction of our Senior Developers. Design and develop back end Microsoft SQL Server database objects…,https://www.indeed.com/rc/clk?jk=841f93f09da7ee7e&fccid=3242052ac9469be6&vjs=3
Front-End Developer,Camping World,"Lincolnshire, IL",30+ days ago,"This work will meet expectation from our Back end/Full-Stack members. Dedication to continual learning, as front-end development and business needs are ever…",https://www.indeed.com/rc/clk?jk=415ca5de0004bff8&fccid=4ec2dc648eedd45e&vjs=3
Agile Development Manager,Motorola Solutions,"Allen, TX",Just posted,"Strong understanding of Agile and the experience to back it up. In this role, you will enable a team of Software Developers to design, develop, test, and deploy…",https://www.indeed.com/rc/clk?jk=dc7be81406ac864a&fccid=22ec6ef3cc441ac2&vjs=3
"Engineer I, Software Engineering",Ticketmaster,"Chantilly, VA",30+ days ago,"You seek new methods and tools to make great websites faster and better, both on the front-end and back-end. Closely interact with senior developers, management…",https://www.indeed.com/rc/clk?jk=c31967201c4ee7ba&fccid=31696df7c99497fd&vjs=3
React UI Developer SP&R,Cisco Systems,"Austin, TX",30+ days ago,"Work with APIs and back-end teams to ensure that UI dependencies are communicated, understood, tested, and delivered. Experience in SPA performance engineering.",https://www.indeed.com/rc/clk?jk=dd3e6db205b5f247&fccid=dfc44f3b8c44a6db&vjs=3
"Applications Developer - Salesforce (Service Cloud & LWC) - Opportunity for Working Remotely Detroit, MI",VMware,"Detroit, MI",14 days ago,"Architectural understanding of end-to-end salesforce platform. You will have opportunities to participate in requirement design discussions with product owners,…",https://www.indeed.com/rc/clk?jk=54fbd22a687fa011&fccid=c762a27145bd166e&vjs=3
Senior Software Development Engineer,Amazon.com Services LLC,"Tempe, AZ",30+ days ago,"Hands-on expertise in many disparate technologies, typically ranging from front-end user interfaces through to back-end systems and all points in between.",https://www.indeed.com/rc/clk?jk=baf9c14eae935d92&fccid=fe2d21eef233e94a&vjs=3
Privacy Engineer,Google,"New York, NY",30+ days ago,"We range from back-end and front-end experts and work cross-functionally with product strategy teams (e.g., Engineering, Legal, Policy, Developer Relations) and…",https://www.indeed.com/rc/clk?jk=31d9cdea4ba26a35&fccid=a5b4499d9e91a5c6&vjs=3
PYTHON DEVELOPER,Bangura Solutions,Remote,23 days ago,Developing back-end components to improve model responsiveness and performance. Familiarity with front-end technologies (such JavaScript and HTML5).,https://www.indeed.com/rc/clk?jk=aea4c535ed6cf391&fccid=f53fad3b59883186&vjs=3
React Developer,"Insight Enterprises, Inc.","Tempe, AZ",30+ days ago,"Experience with back-end technologies. Experience setting up / writing Front End unit, integration, and end to end tests. Expert knowledge of modern JavaScript.",https://www.indeed.com/rc/clk?jk=cd9f0bfeed30a831&fccid=69247daab4a84a92&vjs=3
Software Simulation Developer,Icosystem Corporation,"Cambridge, MA",15 days ago,"Web front end technologies, such as javascript, html and css. A minimum of bachelor’s or an equivalent degree. Solid knowledge of Java (4+ years).",https://www.indeed.com/rc/clk?jk=348b9d865f842789&fccid=764872ed9f766df0&vjs=3
Software Developer II,Charles Schwab,"San Francisco, CA",4 days ago,"Proven ability in delivering solid, secure, performant front-end code and contribute to the design of back end APIs. Knowledge of Web Content Management.",https://www.indeed.com/rc/clk?jk=912c3c86c7097bf5&fccid=3c74eafe288fc8ca&vjs=3
"Sr. Digital Developer, SFCC (US remote opportunity)",Crocs,Colorado,30+ days ago,"They are well-versed in back-end development such as API integrations or SFCC jobs, but can handle complex, front-end experiences as well.",https://www.indeed.com/rc/clk?jk=b986afa4fa3272dd&fccid=964ddf8e96770af1&vjs=3
Business Intelligence Developer,Vanderbilt University Medical Center,"Nashville, TN",Today,Occasional: Bending/Stooping: Trunk bending downward and forward by bending spine at waist requiring full use of lower extremities and back muscles.,https://www.indeed.com/rc/clk?jk=75965af5b87aba65&fccid=9a79b8527fbd5a84&vjs=3
"Manager, Product Manager- Consumer Bank",Capital One - US,"McLean, VA",6 days ago,Empowered. Part of a team driving the bank’s omni-channel servicing portfolio responsible for setting and delivering an experience framework on how our…,https://www.indeed.com/rc/clk?jk=2caea6a091898468&fccid=b85c5070c3d3d8c8&vjs=3
Front End Developer,Global Payments,"Austin, TX",27 days ago,"Working closely with business and product owners, creative designers and back end developers, you'll be involved from the early stages to the release of new…",https://www.indeed.com/rc/clk?jk=d9d50ee53f7d0794&fccid=8a20e0e3ceb4f553&vjs=3
Front-End Developer,NBCUniversal,"Universal City, CA",30+ days ago,Desire to learn and expand back-end development skillset. Own development of functionality across front-end and back-end systems in a Python and ReactJS…,https://www.indeed.com/rc/clk?jk=ef1465d91f0000ac&fccid=35d653c09c2712b6&vjs=3
Android Developer,Athenahealth,"Austin, TX",30+ days ago,"You will collaborate closely with a cross functional team frontend web developers, mobile developers, and backend platform developers.",https://www.indeed.com/rc/clk?jk=02942497a7c302ad&fccid=ca123abbc3ea79a0&vjs=3
Principal Cloud Platform Developer,Citizens,"Dallas, TX",15 days ago,"Proficiency in multiple programming languages, including at least one modern front-end framework (Angular/React/Vue), such as Python, Java, JavaScript, Golang,…",https://www.indeed.com/rc/clk?jk=14fc168bcb536da9&fccid=e4c6a8c0c5c093b0&vjs=3
EPIC ASSOCIATE IT SYSTEMS ANALYST,Allegheny Health Network,"Pittsburgh, PA",30+ days ago,"Accountable for providing project status back to the appropriate management group or customer, release co-coordinator and/or various PMO groups.",https://www.indeed.com/rc/clk?jk=7f8b43625b495a24&fccid=630d3976c54c8209&vjs=3
Remote Junior Web Developer,Scopic,Remote,30+ days ago,Significant fluency in one or more back-end languages (PHP/Node.js/Python/C#). 1+ year of software development experience. Bachelor's degree or higher.,https://www.indeed.com/rc/clk?jk=0bda2a0e627c8c9a&fccid=0c213b537d8bfffd&vjs=3
Python Developer,TELUS International,Pennsylvania,Today,"This is all being built on a web based system - all within AWS, all back-end is also Microsoft products. The Python Developer will be a full-stack developer…",https://www.indeed.com/rc/clk?jk=bb50004e4cc4afd2&fccid=1a93caa31afcad42&vjs=3
Co-op Data Engineering,Measures for Justice,"Rochester, NY",15 days ago,Building a new webapp (both back-end and front-end) for uploading files and running machine learning models against them.,https://www.indeed.com/rc/clk?jk=608f305217a5a871&fccid=58aac7d4a0aa0264&vjs=3
Front-End WebApp Software Developer (Junior),BOEING,"Annapolis Junction, MD",20 days ago,"Hands on end-to-end testing of software and/or hardware applications. Modify the repository schema of an existing application to support new data items, develop…",https://www.indeed.com/rc/clk?jk=de7bd492d55364b6&fccid=edae4285faf6c2f0&vjs=3
Junior Back End Developer,Studio71,"Los Angeles, CA",4 days ago,"Work with front end developers, Product Manger, and CTO to find solutions for a variety of projects. Assist the CTO and senior developers in designing new…",https://www.indeed.com/rc/clk?jk=fe0969633a07febd&fccid=02a5868990442e40&vjs=3
Back-end Developer (Connectivity),IBM,"Austin, TX",5 days ago,To think along with clients and sell. Connectivity is a module used to allow Watson to directly import customers’ data from other data sources and allow it to…,https://www.indeed.com/rc/clk?jk=3d413017124c60de&fccid=de71a49b535e21cb&vjs=3
Junior Software Engineer DIRECTV,AT&T,"El Segundo, CA",30+ days ago,"Our software development teams span the full-stack spectrum, including front-end, back-end and mobile app development. Utilize Agile and/or Scrum Methodology.",https://www.indeed.com/rc/clk?jk=dd3056634961d8a3&fccid=25b5166547bbf543&vjs=3
Front-End Developer Plano/Remote,Voko Communications,"Plano, TX",30+ days ago,Experience working closely with back-end developers and an understanding of how to best manage interfacing with APIs. Knowledge in UI/UX design.,https://www.indeed.com/rc/clk?jk=64e2bdaf074b63bf&fccid=efb03f048ea467d6&vjs=3
Junior Software Engineer,AT&T,"El Segundo, CA",26 days ago,"Our software development teams span the full-stack spectrum, including front-end, back-end and mobile app development. Utilize Agile and/or Scrum Methodology.",https://www.indeed.com/rc/clk?jk=384cbbc7e0b1b516&fccid=25b5166547bbf543&vjs=3
FULL STACK SOFTWARE DEVELOPER,Hyatt Corporate Office,"Chicago, IL",6 days ago,"These responsibilities include architecture, methodology, tools and processes, and delivery management for the development and support of Hyatt.com, mobile apps…",https://www.indeed.com/rc/clk?jk=b864542a4b31b935&fccid=a8adf3f3398fa891&vjs=3
Back-End Engineer,AvantStay,Remote,30+ days ago,Ideal candidates will be experienced and passionate with building scalable back-end technologies. Support members of a project in delivering backend services…,https://www.indeed.com/rc/clk?jk=beb9825baa20bdd5&fccid=ec40aabb0ba20677&vjs=3
Software Engineer (ECDP),Apple,"Austin, TX",30+ days ago,"Programming knowledge in at least one of the following areas: Server side development (Java), Web development (JavaScript, HTML, CSS3) or iOS development …",https://www.indeed.com/rc/clk?jk=936b858477bc4332&fccid=c1099851e9794854&vjs=3
"Security Engineer, Infrastructure Protection",Google,"New York, NY",30+ days ago,Our Security team works to create and maintain the safest operating environment for Google's users and developers.,https://www.indeed.com/rc/clk?jk=a56aeb4403451a59&fccid=a5b4499d9e91a5c6&vjs=3
"Software Engineer, Data Collections",The New York Times,"New York, NY",30+ days ago,Knowledge of front-end analytics implementation and tag management systems. We also work with native app developers to support Android and iOS shared libraries…,https://www.indeed.com/rc/clk?jk=e4ec15fc09168558&fccid=1b50fcfb150b1b48&vjs=3
Agile Development Manager,Motorola Solutions,"Allen, TX",Just posted,"Strong understanding of Agile and the experience to back it up. In this role, you will enable a team of Software Developers to design, develop, test, and deploy…",https://www.indeed.com/rc/clk?jk=dc7be81406ac864a&fccid=22ec6ef3cc441ac2&vjs=3
"Engineer I, Software Engineering",Ticketmaster,"Chantilly, VA",30+ days ago,"You seek new methods and tools to make great websites faster and better, both on the front-end and back-end. Closely interact with senior developers, management…",https://www.indeed.com/rc/clk?jk=c31967201c4ee7ba&fccid=31696df7c99497fd&vjs=3
React UI Developer SP&R,Cisco Systems,"Austin, TX",30+ days ago,"Work with APIs and back-end teams to ensure that UI dependencies are communicated, understood, tested, and delivered. Experience in SPA performance engineering.",https://www.indeed.com/rc/clk?jk=dd3e6db205b5f247&fccid=dfc44f3b8c44a6db&vjs=3
Privacy Engineer,Google,"New York, NY",30+ days ago,"We range from back-end and front-end experts and work cross-functionally with product strategy teams (e.g., Engineering, Legal, Policy, Developer Relations) and…",https://www.indeed.com/rc/clk?jk=31d9cdea4ba26a35&fccid=a5b4499d9e91a5c6&vjs=3
PYTHON DEVELOPER,Bangura Solutions,Remote,23 days ago,Developing back-end components to improve model responsiveness and performance. Familiarity with front-end technologies (such JavaScript and HTML5).,https://www.indeed.com/rc/clk?jk=aea4c535ed6cf391&fccid=f53fad3b59883186&vjs=3
React Developer,"Insight Enterprises, Inc.","Tempe, AZ",30+ days ago,"Experience with back-end technologies. Experience setting up / writing Front End unit, integration, and end to end tests. Expert knowledge of modern JavaScript.",https://www.indeed.com/rc/clk?jk=cd9f0bfeed30a831&fccid=69247daab4a84a92&vjs=3
Software Simulation Developer,Icosystem Corporation,"Cambridge, MA",15 days ago,"Web front end technologies, such as javascript, html and css. A minimum of bachelor’s or an equivalent degree. Solid knowledge of Java (4+ years).",https://www.indeed.com/rc/clk?jk=348b9d865f842789&fccid=764872ed9f766df0&vjs=3
"Sr. Digital Developer, SFCC (US remote opportunity)",Crocs,Colorado,30+ days ago,"They are well-versed in back-end development such as API integrations or SFCC jobs, but can handle complex, front-end experiences as well.",https://www.indeed.com/rc/clk?jk=b986afa4fa3272dd&fccid=964ddf8e96770af1&vjs=3
C#.net Developer/Integration,WellSpan Health,"York, PA",Just posted,"Experience with Lawson and Kronos back end development a major plus. Under general supervision, formulates/defines specifications for complex Application Data…",https://www.indeed.com/rc/clk?jk=ffb23e151bb02e2a&fccid=a0a2e77cb67c0f11&vjs=3
Front-End WebApp Software Developer (Junior),BOEING,"Annapolis Junction, MD",20 days ago,"Hands on end-to-end testing of software and/or hardware applications. Modify the repository schema of an existing application to support new data items, develop…",https://www.indeed.com/rc/clk?jk=de7bd492d55364b6&fccid=edae4285faf6c2f0&vjs=3
Frameworks Software Engineer- App Store,Apple,"Seattle, WA",30+ days ago,"Help design and implement APIs used by Apple employees and developers around the world. To deliver such a rich experience at this scale, the engineers build…",https://www.indeed.com/rc/clk?jk=47a9b069b3211d32&fccid=c1099851e9794854&vjs=3
C++ Developer for Production Support,FileWave,"Indianapolis, IN",30+ days ago,Perform back-end (daemon) services written in C++. Develop front end-tools written using Qt. The focus of your work will be providing code and technical support…,https://www.indeed.com/rc/clk?jk=3484ff1c6bfecf70&fccid=46f6589e120d55e0&vjs=3
Senior Support Engineer - Salesforce Core Media,VF Corporation,"Denver, CO",12 days ago,2+ years of developer experience within Salesforce Core Media and Supporting technologies. Opportunity to serve as a lead developer of a small team with the…,https://www.indeed.com/rc/clk?jk=241577a3d3c6b9f3&fccid=c734dc8b03fc4451&vjs=3
SITE OPERATIONS ENGINEER,Foot Locker,"Camp Hill, PA",30+ days ago,"Perform advanced diagnostics and troubleshooting of issues affecting both back-end and front-end services by analyzing logs, executing queries, and utilizing…",https://www.indeed.com/rc/clk?jk=310ae13f0eb8d893&fccid=5c616ca9b51e8497&vjs=3
Front End Web Developer,Imagemakers,"Wamego, KS",30+ days ago,"Must be an expert in front-end development technologies. Being an expert in front-end development technologies including but not limited to: HTML, CSS, and…",https://www.indeed.com/rc/clk?jk=a4a42c19e1727579&fccid=4e586cc532dfbb63&vjs=3
Senior Data Engineer,Keller Williams,United States,6 days ago,"You will contribute to our data pipelines that are used everyday to inform our business decisions. Design, develop, and implement data infrastructure and…",https://www.indeed.com/rc/clk?jk=d7d675560a1969ec&fccid=ff5d5c17ad67de08&vjs=3
Back End Developer (SQL/C#),Columbia Sportswear Company,"Portland, OR",22 days ago,Participate with other developers and architects to establish best practices. You will collaborate directly with the Product Development Team on a daily basis…,https://www.indeed.com/rc/clk?jk=49a8dbeb444accde&fccid=e87d9cecd33775c9&vjs=3
Back End Web Developer,Christian Broadcasting Network,United States,30+ days ago,Information Technology – Remote (U.S. based). The Christian Broadcasting Network (CBN) is seeking an experienced Back End Web Developer to design and architect…,https://www.indeed.com/rc/clk?jk=e05cd2892002491a&fccid=71af863bd7ffc1b4&vjs=3
Front-End Developer,The Marlin Alliance,"San Diego, CA",30+ days ago,"Experience working on both Front end and Back end technologies such as web frameworks and databases. Using your comprehensive knowledge of various technologies,…",https://www.indeed.com/rc/clk?jk=debcb1aa71c7f0b4&fccid=7e33e91cd0bb4175&vjs=3
"Web Developer/DBA, Medicine - Office of Information Technology",Florida State University,"Tallahassee, FL",30+ days ago,"Experience developing data-driven web applications, preferably in C# with MS SQL Server back end. Experience with front-end technologies: HTML5, Javascript,…",https://www.indeed.com/rc/clk?jk=7ace1ec0e56cfab7&fccid=346ac9e4a1d7060b&vjs=3
"Software Engineer, Vehicle User Interface",Tesla,"Palo Alto, CA",30+ days ago,"You will need to collaborate with our top-notch design team and back end developers. You will be responsible for the look and feel of the user experience,…",https://www.indeed.com/rc/clk?jk=dd4056db011f8b68&fccid=86e9be6ce380173e&vjs=3
WordPress Developer,Creative2,United States,14 days ago,Designing and managing the website back-end including database and server integration. You will be responsible for both back-end and front-end development…,https://www.indeed.com/rc/clk?jk=64bc60f9cd745e38&fccid=251d174aed0e0cb0&vjs=3
Web Developer,Isys Technologies,"Fort Huachuca, AZ",30+ days ago,Front and back end developing experience. ISYS Technologies is seeking a Web Developer. MS sequel .net on the backend.,https://www.indeed.com/rc/clk?jk=89069e4f6723f90b&fccid=f61f2c78b8598e19&vjs=3
Software Developer,Cavnue,"San Francisco, CA",30+ days ago,Front-end application design experience for at least three or more web-native applications OR. We're looking for developers who understand when to use open…,https://www.indeed.com/rc/clk?jk=22546dec8d451a1e&fccid=c9c0489378abdd9a&vjs=3
Front End/React Developer,Ivy Tech Solutions inc,Remote,30+ days ago,"Most of their day will be spent coding, but developers work very closely and collaborate often. Technical – JavaScript framework – React, CSS, SASS, HTML5,…",https://www.indeed.com/rc/clk?jk=3ebbf87bc0a42d15&fccid=dfecc8bbe451f8c2&vjs=3
Word Press Developer,Oozle Media,"Sandy, UT",30+ days ago,You will need to be able to slice a PSD into a fully-functioning website using a blank template (without tweaking existing WordPress templates).,https://www.indeed.com/rc/clk?jk=ae5c04c34cd8d98d&fccid=1e99f7666fda15e0&vjs=3
Database Developer - Remote,KAPSCH,Texas,2 days ago,"As part of the Database / Back-office team, you will work on Oracle Database solutions, which store and process toll system transactions and operations data.",https://www.indeed.com/rc/clk?jk=24660060a9d48040&fccid=e0811ee355cfbd31&vjs=3
Program Manager,General Motors,"Austin, TX",6 days ago,"Collaborates with cross-functional teams including architects, software engineers, developers and technical leads to ensure timely delivery of projects.",https://www.indeed.com/rc/clk?jk=85369435498b86e3&fccid=116680a29a847a70&vjs=3
Junior Backend Developer,Applied Insight,"Reston, VA",8 days ago,"Highly experienced with back-end programming languages (Ex: Python, Java, JavaScript, MySQL, Django, etc.). Collaborate with the rest of the engineering team to…",https://www.indeed.com/rc/clk?jk=60a8f3f121bede0d&fccid=abe7b6801524c7e0&vjs=3
Computer Systems Analyst I,Montana State University,"Bozeman, MT",15 days ago,Provide back-up support for team members within the Finance & Accounting Systems Team. Finance & Accounting Systems Team within University Information…,https://www.indeed.com/rc/clk?jk=071cf6a92e5ca149&fccid=2d17a4df6e9b046f&vjs=3
Front end Angular 8 Developer,TanPro ITCorp,"Charlotte, NC",30+ days ago,Back END also need(java).,https://www.indeed.com/rc/clk?jk=57a9f535cdb8b34f&fccid=411a7388f3bb2199&vjs=3
Web Developer,University of Portland,"Portland, OR",30+ days ago,"Provide technical expertise in front- and back-end web development. Support web infrastructure by providing end-user support, applications maintenance, product…",https://www.indeed.com/rc/clk?jk=e8a57c67f55281b9&fccid=9dca22f0f6539f73&vjs=3
Jr. Website Developer,GARBAGE DREAM,"Pomona, CA",30+ days ago,"Preferred: Additional basic to intermediate knowledge of web back-end development using PHP, the Magento 2 e-commerce platform, and SQL databases.",https://www.indeed.com/rc/clk?jk=4787327074ef900e&fccid=5561b4db9ecf4370&vjs=3
Qlik Sense Developer,Guidehouse,Remote,9 days ago,"Experience in end-to-end implementation of BI projects for developing a portfolio of scorecards, KPIs, reports & dashboards. Experience with NPrinting a plus.",https://www.indeed.com/rc/clk?jk=8800e15df0e1b868&fccid=b8fdf400786b78b1&vjs=3
Full Stack Software Developer,NPR,"Washington, DC",8 days ago,"Mastery of native JavaScript, with experience using Node.js and any front end frameworks such as AngularJS, Vue, React, etc.",https://www.indeed.com/rc/clk?jk=fe4a6ea701517d30&fccid=15d9afdbc1e1cdf0&vjs=3
REMOTE/Updated: Sr. Front-End Software Engineer (Remote Opportunity),Hallmark,"Kansas City, MO",27 days ago,5+ years professional front-end programming experience. Build intuitive user interfaces and great user experiences on various clients in multiple front-end…,https://www.indeed.com/rc/clk?jk=609668d75b50ac88&fccid=f6b7f1c44b44197c&vjs=3
Quality Assurance Engineer I,Amazon.com Services LLC,"Cupertino, CA",12 days ago,"4+ years of experience, which may be composed of experience as a developer, experience as a QA Engineer, or experience as an SDET.",https://www.indeed.com/rc/clk?jk=149c1dd69facb7a4&fccid=fe2d21eef233e94a&vjs=3
