JobTitle,Company,Location,PostDate,Summary,JobUrl
Senior Software Developer - Home Services,Redfin,"Seattle, WA",30+ days ago,"Full-stack experience: 5+ years of experience as a software developer, working on both front and back-end features.",https://www.indeed.com/rc/clk?jk=3a215bf5ab7846e1&fccid=ccaacd9cca9fffe8&vjs=3
Senior Test Analyst,Strategic Resource Team,"Nashville, TN",5 days ago,Extensive experience using SQL Queries to perform database and back-end testing. Communicates results to automation developers and key stakeholders.,https://www.indeed.com/rc/clk?jk=010a823048c7638a&fccid=d30444ba6bddfd37&vjs=3
Software Developer - Tech Lead (Contact Center Technology),Ally Financial Inc.,"Charlotte, NC",30+ days ago,"Partner with business, UX design and back-end API teams to stand up contact center capabilities across delivery channels of voice, chat, sms/mms and push…",https://www.indeed.com/rc/clk?jk=7901fe437961ed3a&fccid=f8c85b296194776f&vjs=3
Word Press Developer,Ossisto,"Perth Amboy, NJ",30+ days ago,"Strong understanding of PHP back-end development. We are seeking a Word Press Developer responsible for both back-end and front-end development, including…",https://www.indeed.com/rc/clk?jk=b34a3b4153438449&fccid=c84a50fbacf351fd&vjs=3
Technical Leader/Senior Front End Developer,Cisco Systems,"San Jose, CA",30+ days ago,Develop new user-facing features. Build reusable code and libraries for future use. Ensure the technical feasibility of UI/UX designs.,https://www.indeed.com/rc/clk?jk=9958d57d533f3e1f&fccid=dfc44f3b8c44a6db&vjs=3
Sr Software Application Developer,Bright Horizons Family Solutions,"Newton, MA",30+ days ago,This will be a full stack role with an emphasis on back-end/. Net Development. The ideal candidate will have prior demonstrated experience and mastery of…,https://www.indeed.com/rc/clk?jk=331b27830e2c1f82&fccid=f88ce7308732d284&vjs=3
Cleared Senior C++ Software Engineer,RT Logic,"Colorado Springs, CO",30+ days ago,"Their mission is designing and implementing software, hardware, and cloud-based computing systems to process and deliver RF SDA data products.",https://www.indeed.com/rc/clk?jk=282881eb62ab7010&fccid=f5d158e3b2ce4fae&vjs=3
WordPress Developer,The Bowen Group,"Stafford, VA",8 days ago,Designing and managing the website back-end including database and server integration. Designing and building the website front-end.,https://www.indeed.com/company/The-Bowen-Group/jobs/Wordpress-Developer-b79f58d1c2744b30?fccid=ff9eaef76e788cbb&vjs=3
Full Stack Developer,JLM HR Consulting LLC,"Washington, DC",13 days ago,Knowledge of multiple back-end languages (Python and Node.js). This person will help build user interface and back-end components to ensure our applications are…,https://www.indeed.com/rc/clk?jk=cab04b7f4b69e4ba&fccid=02de096b789d2e1d&vjs=3
Sr. Back-End Software Engineer,IBM,"Cambridge, MA",22 days ago,"As a member of the IBM Security SOAR development team, you will be working on back-end services, end-to-end system design, and data analytics.",https://www.indeed.com/rc/clk?jk=fea4e02437ab2bf6&fccid=de71a49b535e21cb&vjs=3
Senior Full Stack Web Developer,Bridge,Remote,30+ days ago,"Experience leading development of multiple features, including both front and back end components. On a day to day basis, you’ll be expected to write clean Ruby…",https://www.indeed.com/rc/clk?jk=22c5431d30c72ea7&fccid=0788493daa8b6896&vjs=3
Front-End Developer,Varen Technologies,"Reston, VA",28 days ago,"Ina robust DevSecOps environment, you will coordinate with UI and UX designers and back-end developers to create a seamless user experience using Vue, Angular…",https://www.indeed.com/rc/clk?jk=36769ba371eae125&fccid=898cb537778fecc3&vjs=3
Sr. Front End Web Developer,Smartlocating Corporation,Remote,30+ days ago,Some experience with back-end development. 6+ years experience as a front-end developer. Good understanding of Typescript / Angular 7+.,https://www.indeed.com/rc/clk?jk=4a6e2ac8b49b9eb0&fccid=fcf42d9d883ae5bd&vjs=3
Full Stack Developer (.NET Developer),Changeis,Massachusetts,22 days ago,Please note that required technical skills include 8-10 years of front/back-end full stack development experience using .,https://www.indeed.com/rc/clk?jk=674f56cbf9cf06b5&fccid=f0879d3f28f599a9&vjs=3
Back-End Software Developer Career,Caxy Interactive,"Chicago, IL",30+ days ago,"We are a team of talented developers who work in cross-functional teams with seasoned Product Managers, UX architects, and digital designers.",https://www.indeed.com/rc/clk?jk=9ab0579ae311b96f&fccid=f1b71e74a321cf48&vjs=3
Web Application Developer,Logicdrop,Remote,30+ days ago,Developing front-end web user interface components that communicated with various back-end services. Bachelor’s degree in a Computer Science related field.,https://www.indeed.com/rc/clk?jk=708ee86bd6f6cd6d&fccid=5f8eebaaa8e57473&vjs=3
Front End Web Developer,Kurt J Lesker,"Jefferson Hills, PA",30+ days ago,"This person reports directly to the Global Digital Marketing Manager, and is part of the Marketing Group of the company working closely with product management…",https://www.indeed.com/rc/clk?jk=32fd0aa6e95f36e0&fccid=bfc7b71c5fa5b9af&vjs=3
Senior Software Engineer- Math Automated Scoring,Pearson,"Nashville, TN",30+ days ago,"Diverse technical skills, and an ability to shift between the development of front- and back-end systems. As a Software Developer, your primary responsibility…",https://www.indeed.com/rc/clk?jk=c3506d0561d98eca&fccid=915b1c0ee87e5e8a&vjs=3
Senior Front-End/UI Developer,Oracle,United States,30+ days ago,"You have a knack for building tools to simplify developer lives. You have full mastery of CSS, know when to use grids vs flex-box vs floats, and have a deep…",https://www.indeed.com/rc/clk?jk=32910e846cef0858&fccid=cd22d01053af7669&vjs=3
VP of Technical Operations,"Amyris, Inc.","Emeryville, CA",30+ days ago,"Ability to build and maintain strong relationships with business users, software developers, other cross-functional co-workers, and outside partners.",https://www.indeed.com/rc/clk?jk=5c1c8fe532338221&fccid=51d47d35f8f71f7d&vjs=3
Program Manager,General Motors,Georgia,6 days ago,"Collaborates with cross-functional teams including architects, software engineers, developers and technical leads to ensure timely delivery of projects.",https://www.indeed.com/rc/clk?jk=82f2d8c645eeecc9&fccid=116680a29a847a70&vjs=3
SharePoint Lead,Howmet Aerospace,"Pittsburgh, PA",Today,"The SharePoint and Power Platform Technical Lead will serve dual roles, as a SharePoint Architect and SharePoint development - participating in the evaluation,…",https://www.indeed.com/rc/clk?jk=2858f88140a5b9f4&fccid=33b2c081c585c8f2&vjs=3
IOS Mobile Developer,Monster Energy,"Corona, CA",28 days ago,Familiarity with RESTful APIs to connect iOS applications to back-end services. Design and build applications for the iOS platform.,https://www.indeed.com/rc/clk?jk=6b7dfc4f6010fd5f&fccid=eac377ee0816c002&vjs=3
Lead Web Developer Job,MadAddie Marketing,"Glenville, NY",30+ days ago,Has super hero strength with back-end development and integration with other business management systems (CRM/Financial/Automated Marketing).,https://www.indeed.com/rc/clk?jk=f4898e17aea23bed&fccid=0177559787ee7204&vjs=3
ARCHITECT,Foot Locker,"San Angelo, TX",22 days ago,"A minimum of 8 years architecture experience, building back-end systems and minimum of 3 years of experience in building scalable RESTful API’s.",https://www.indeed.com/rc/clk?jk=f394a2a9ec74610f&fccid=5c616ca9b51e8497&vjs=3
Programmer Analyst Fulltime job,Advithri Technologies,"Frisco, TX",30+ days ago,"Utilize Java to retrieve, locate and store data efficiently from Oracle and SQL server as back-end databases on Windows, Unix and Linux environments.",https://www.indeed.com/rc/clk?jk=94a259817ab25126&fccid=bb02ee06e6e4268a&vjs=3
Principal Software Developer,Aspen Technology,"Houston, TX",30+ days ago,Make decisions that will influence a scalable front & back-end architecture. Demonstrated technology leadership to scope and estimate the overall project…,https://www.indeed.com/rc/clk?jk=2b505721522887dc&fccid=b3fc015a7c99e39b&vjs=3
IBM ACE / IIB Developer | Fully Remote,Apexon,"Salt Lake City, UT",30+ days ago,Ideal Candidate will need strong back-end development and experience with the following: Our client is migrating some legacy services to a new IBM platform.,https://www.indeed.com/rc/clk?jk=1fcdaca126efa2af&fccid=784ed0ea1f56bb8a&vjs=3
PHP Developer,IT Pandits,"Ashburn, VA",30+ days ago,"PHP developers usually develop back-end components, connect the application with the other (often third-party) web services, and support the front-end…",https://www.indeed.com/rc/clk?jk=ff98d8975eb6cabc&fccid=f71f258e3a32a3bd&vjs=3
Applications Developer,Cuyahoga Community College,"Cleveland, OH",Today,"Partners closely with end-users to obtain solution requirements prior to development activities. Responds to, investigates and resolves issues reported by end…",https://www.indeed.com/rc/clk?jk=4143db997ebd430b&fccid=51ebf0b9fe1bc25e&vjs=3
Software Engineer,Leidos,"McLean, VA",19 days ago,"This work involves development and maintenance of various back end systems for such things as roadside data collection and storage, web mapping tools,…",https://www.indeed.com/rc/clk?jk=339d5c685a3f3207&fccid=8765a4045377753a&vjs=3
Salesforce Tech Lead,Anthem,"Atlanta, GA",30+ days ago,"Experience in building high performance, highly scalable, client server applications using Java (or equivalent back-end language) with Spring Boot and / or…",https://www.indeed.com/rc/clk?jk=d0ba292ff905a663&fccid=2a4da7fa99f4b9ae&vjs=3
Sr Software Developer,Spectrum,"Charlotte, NC",15 days ago,"Support custom Java applications including outage call backs, notifications, and customer communication with complex web services integration to back-end…",https://www.indeed.com/rc/clk?jk=98cce0b9f7778272&fccid=c2d1b0769a534b4d&vjs=3
QA Analyst,Intone Networks,"Dallas, TX",30+ days ago,"QA Analyst with hands-on experience with BI Tools such as Power BI, Tableau, or Cognos (will be working in a Power BI environment) All Manual Testing · QA will…",https://www.indeed.com/rc/clk?jk=24bf1500729483d5&fccid=3ed0572c448b2368&vjs=3
PHP Web Developer,BEST BRANDS,"Los Angeles, CA",30+ days ago,"This is a full-time position at our Beverly Hills office. You’ll be responsible for delivering professional, functional sites with clean code that follow the…",https://www.indeed.com/rc/clk?jk=8950e306ca08c540&fccid=e43bea8740f3c01f&vjs=3
Software Engineer and Architect,MSCI Inc.,"Norman, OK",2 days ago,"The developer will need to have a strong development background and be able to look holistically across the system, and jump in where needed by writing code,…",https://www.indeed.com/rc/clk?jk=ce2142877f0036f2&fccid=ddf716c161cc9a6a&vjs=3
FULL STACK DEVELOPERS,PNI Digital Media,"Levels, WV",30+ days ago,"Developing clean, high-quality, high-performance and maintainable software in both Front-end and Backend. Relocation to Vancouver, BC may be considered.",https://www.indeed.com/rc/clk?jk=f0176cd9f9e120ff&fccid=c467efa14d7654d8&vjs=3
Senior Backend Developer,Grid Dynamics,"San Francisco, CA",20 days ago,"Experience in unit testing (unit, integration, and end-to-end). Working on the development of common practices for backend implementation across mission…",https://www.indeed.com/rc/clk?jk=192d8c252bd8e982&fccid=9e6cc9e51c2613ab&vjs=3
Backend Developer,Pollenly,"Santa Monica, CA",30+ days ago,"Experience with end-to-end data and large-scale performance challenges. Previous to our company, brands had to use external links or reference codes to track…",https://www.indeed.com/rc/clk?jk=232fc8b4f8cc633b&fccid=9b11442cf75b1c20&vjs=3
GPSC Full Stack Senior Developer,General Motors,"Roswell, GA",1 day ago,"Automates unit/end-to-end testing of software systems within their domain, focused on software quality and maintainability.",https://www.indeed.com/rc/clk?jk=dddeadd1ec6a0626&fccid=116680a29a847a70&vjs=3
Technical Lead - Mortgage,Redfin,"Frisco, TX",30+ days ago,You are an experienced developer with 8+ years of experience designing complex distributed systems. Our team will need to expand the capability of our back…,https://www.indeed.com/rc/clk?jk=627f42df2f69d4f1&fccid=ccaacd9cca9fffe8&vjs=3
"Prin, Full-Stack Dev",BNY Mellon,"New York, NY",13 days ago,This will be a hands on role focusing on full SDLC development for turn-key solutions for end to end wealth management process on new and leading edge digital…,https://www.indeed.com/rc/clk?jk=92f695a050798c91&fccid=b4048be2884af072&vjs=3
Software Engineer,Cengage,"Raleigh, NC",13 days ago,Responsible for end-to-end delivery. Full stack engineering with JavaScript frameworks like jQuery and React.js on the front end and Java or Perl services on…,https://www.indeed.com/rc/clk?jk=b8500328aee28a78&fccid=cd7072017d299499&vjs=3
Lead Software Engineer,Dana-Farber Cancer Institute,"Boston, MA",7 days ago,"Proficient knowledge of multiple back-end programming languages (Java, Python, Ruby, . Coordinate the work of a small team of software developers; refine and…",https://www.indeed.com/rc/clk?jk=7af8be5320dfe948&fccid=31a15643b156b0a5&vjs=3
"Sr. SDE, Full Stack Developer",Office Depot OfficeMax,"Boca Raton, FL",Today,"Ideal candidates should be a full stack developer having experience developing front-end, middle-tier and back-end systems. Java EE and/or Golang.",https://www.indeed.com/rc/clk?jk=23505076cf6ab656&fccid=18aa19122de0323c&vjs=3
"Software Engineer, Developer Experience",NEAR,Remote,30+ days ago,"Comfort operating across the full stack including front end web, mobile, back end, smart contracts and dev ops. Participating in the on-call rotation.",https://www.indeed.com/rc/clk?jk=32d4be499f072827&fccid=a089a346aa023259&vjs=3
Senior Oracle Database Developer,"Amyx, Inc.","Philadelphia, PA",30+ days ago,"Net developers, lower-level database developers, systems analysts). Primary responsibilities are to Architect, Design, Develop and Implement Oracle Database…",https://www.indeed.com/rc/clk?jk=2225ec8b5ac20103&fccid=c8065917ab1f5e6e&vjs=3
AEM Developer,Cardinal Health,"Dublin, OH",30+ days ago,"Experience with communicating to different internal servers, databases from AEM, using both front end (ajax, cookies) and back end technologies (servlet, osgi…",https://www.indeed.com/rc/clk?jk=f34ca5e5b1bd7137&fccid=87b328666e50453b&vjs=3
Full Stack Developer,BNY Mellon,"Jersey City, NJ",30+ days ago,This mid-level full stack developer would. Compiles documentation written by more senior developers of all procedures used in system.,https://www.indeed.com/rc/clk?jk=cbe3fe253c2dbcfa&fccid=b4048be2884af072&vjs=3
Photoshop Machine Learning Engineer,Adobe,"San Jose, CA",15 days ago,"Develop end-to-end solutions from back-end algorithms to front-end user experience. Collaborate with researchers, developers, UI designers, product managers,…",https://www.indeed.com/rc/clk?jk=902ec8ede510df06&fccid=f89deb5a97c7738a&vjs=3
Front End Developer,Neoscape,"Boston, MA",30+ days ago,"Expert knowledge of modern back-end development and back-end JavaScript (Node.js, Express). A deep understanding of front-end development issues and browser…",https://www.indeed.com/rc/clk?jk=2b1d1e17ed90eb4b&fccid=092dbac332883aef&vjs=3
Full Stack Web Development Associate,University of Texas at Austin,"Austin, TX",30+ days ago,Experience with both front-end and back-end web development. We are seeking a energetic software developer with a solid understanding of web development and…,https://www.indeed.com/rc/clk?jk=863f002aec20df71&fccid=f7282ad3490137c7&vjs=3
Quality Assurance (QA) Developer,Yardline,New York State,30+ days ago,"As a Q uality A ssurance Developer on the Yardline team, you will plan, develop, and execute tests against back-end APIs and front-end applications that are…",https://www.indeed.com/rc/clk?jk=e3418e1d479867f1&fccid=1a6403f5a8617d71&vjs=3
Software Engineer II,Upland Software,Remote,13 days ago,A successful candidate will be able to quickly scale up into a SPA front-end and Ruby on Rails back end. Work with support team to fix any bugs that arise in…,https://www.indeed.com/company/Upland-Software/jobs/Software-Engineer-23ffb3669f806c2e?fccid=b29545c1d183062e&vjs=3
Data Analyst,North Carolina Dept of State Treasurer,"Wake County, NC",7 days ago,"Work with data engineers and data architects to define back-end requirements for data products (aggregations, materialized views, tables, visualizations);",https://www.indeed.com/rc/clk?jk=e7daa4ddaf27adcd&fccid=d7d01a85ca84ff20&vjs=3
"Senior Engineer, Front-End and Data Science",Dermalogica,"Carson, CA",30+ days ago,"As a front-end developer, this role will be responsible for developing, deploying, and maintaining front-end code bases for a handful of projects, some of which…",https://www.indeed.com/rc/clk?jk=c5cdf6a6f52d198b&fccid=72f866b0472f5398&vjs=3
Product Manager,Stanford University,"Redwood City, CA",5 days ago,"Collaborate with front- and back-end developers, partners, and leadership as the Product Manager for Stanford Mobile.",https://www.indeed.com/rc/clk?jk=f4f5dd00eb021b8c&fccid=1ba7f338730ce720&vjs=3
React Web Developer,Cryptospace,"San Pedro, CA",30+ days ago,Collaborate with back-end developers and web designers to improve usability.,https://www.indeed.com/rc/clk?jk=c5a8a341bbefae88&fccid=dd616958bd9ddc12&vjs=3
"EHR/EMR Electronic Health Record Data Analyst-Tucson, AZ",Easterseals Blake Foundation,"Tucson, AZ",5 days ago,Proficiency in training end-users with varying levels of technology skill. The EHR Data Analyst will also assist in maintain the back and front-ends of EBF’s…,https://www.indeed.com/rc/clk?jk=dca5fe56e3debaa3&fccid=a0e8f51dc8698ebb&vjs=3
"Director, Quality Engineering",S&P Global,"Richmond, VA",30+ days ago,"Develop and implement quality test infrastructure across multiple channels including web, mobile, service layers, back-end, and integration.",https://www.indeed.com/rc/clk?jk=f59e4839b2a988da&fccid=b716e44d2c6283e7&vjs=3
Python (Django/Flask) Developer,Trood,"New York, NY",30+ days ago,"Professional knowledge of Python, Django, or Flask. High professional motivation and ambition. Knowledge and experience in the application of design patterns,…",https://www.indeed.com/rc/clk?jk=a5fe3ba2a2ecdbe2&fccid=dd616958bd9ddc12&vjs=3
"Content developer, Digital",Tapestry,"New York, NY",30+ days ago,"Managerial Courage: Doesn’t hold back anything that needs to be said; provides current, direct, complete, and “actionable” positive and corrective feedback to…",https://www.indeed.com/rc/clk?jk=aae247fec17644c7&fccid=4b0e713ef50478fa&vjs=3
WordPress Developer,Catena Media,United States,15 days ago,"Strong understanding of PHP back-end development. Will be responsible for both back-end and front-end development, including creating WordPress themes and…",https://www.indeed.com/rc/clk?jk=eafbad95eb84aba1&fccid=8caed17547b5ffdd&vjs=3
Python developer,VAUXOO,"Colima, GA",30+ days ago,You enjoy coding by hand as well as using frameworks. And you’re full of ideas. You work on a certain framework or existing apps.,https://www.indeed.com/rc/clk?jk=f7669fcbd77ecd11&fccid=5293418a7e661884&vjs=3
Front End UI Developer,Frontier Communications,"Frontier, ND",30+ days ago,Work with interface designers and back-end engineers to ensure design integrity across the Frontier suite of websites. Experience with Sitecore a plus.,https://www.indeed.com/rc/clk?jk=b8a3d8aa07ffc1e9&fccid=81d1e68cec787077&vjs=3
Full-Stack Software Engineer,walrus.ai,"San Francisco, CA",30+ days ago,"Through a combination of human intelligence and computer execution, we offer quick and reliable monitoring and testing from simple, plain-English instructions.",https://www.indeed.com/rc/clk?jk=e36800dc20fe3171&fccid=5895c70dd829be30&vjs=3
Learning Experience Information Architect,Southern New Hampshire University,Remote,6 days ago,"8+ years of experience in an Information Architect or Content Strategy/Content Development role, specifically designing and developing information architecture…",https://www.indeed.com/rc/clk?jk=91ac8a0d50a633b0&fccid=10119bc008fd8b8d&vjs=3
Senior Front End Developer,Power Costs Inc,"Norman, OK",30+ days ago,"Assure that all user input is validated before submitting to back-end. For almost 30-years, PCI has set the standard for developing customer-focused, customer…",https://www.indeed.com/rc/clk?jk=8ed93b95de582533&fccid=92594dc01ef697d2&vjs=3
Reporting Developer,DISH,"Englewood, CO",5 days ago,The department also provides support for back office operations and processes. Act as a consultant for internal customers to ensure the ideal end product.,https://www.indeed.com/rc/clk?jk=f728f54a1381bb73&fccid=3c371b712ace44cf&vjs=3
Web Developer - 0621 (REMOTE),Miles Partnership,Colorado,29 days ago,"Integrates data from various back-end services and databases. Remote (CO) - City Flexible, CO. 5+ recent years of experience developing modern websites and…",https://www.indeed.com/rc/clk?jk=b1d3804de19bc11b&fccid=3782268a3b9eb6cb&vjs=3
"Senior Software Engineer, Back-end - Platform Experience",Twitter,"San Francisco, CA",30+ days ago,Our platform serves thousands of internal customers running the thousands of services that make up our product.,https://www.indeed.com/rc/clk?jk=99ec408c266da2ce&fccid=7a3824693ee1074b&vjs=3
Head of Data Engineering,Barings,"Charlotte, NC",14 days ago,"As the head of the Data Engineering, you will be responsible for developing people and data products with your experience as a leader using modern data…",https://www.indeed.com/rc/clk?jk=e3f1c10da149629e&fccid=de8f3ae4683650a6&vjs=3
Website Developer,Weston Baker Creative Group,"New York, NY",30+ days ago,Capable of taking full responsibility for front- and back-end development of websites and apps. 1+ years experience within a dedicated website developer role.,https://www.indeed.com/rc/clk?jk=66a888895307cdb0&fccid=ab7ac3fdb8e6adbe&vjs=3
"Front End Developer, Mid",Booz Allen Hamilton,"Honolulu, HI",30+ days ago,"You’ll work with data scientists and back-end developers to create a seamless user experience using JavaScript, HTML, CSS, and modern web application…",https://www.indeed.com/rc/clk?jk=3e2cc68edee49a1d&fccid=4e041af1d0af1bc8&vjs=3
Back-end Engineer (Python),CartPilot.,"Chicago, IL",30+ days ago,1-2+ years of industry experience with Django/Python. Solid understanding of Agile development practices and Lean Software Development principles.,https://www.indeed.com/rc/clk?jk=b4ac68e9141d6ba7&fccid=896b9a72a9000e14&vjs=3
Front- End Architect,Stanley Black & Decker,"Miramar, FL",30+ days ago,"Creates, reviews and delivers end-user documentation (user guide, process flow charts, training materials) and training for accuracy.",https://www.indeed.com/rc/clk?jk=9cc21aefdded2952&fccid=d30328706976dba9&vjs=3
Junior Developer,Tecture LLC,"Chicago, IL",30+ days ago,"We offer generous vacation time, scheduled summer half days, and a nice end-of-the-year break. AWS Serverless Microservices - Angular front-end, Node.js backend…",https://www.indeed.com/rc/clk?jk=c3e0a41d86fee32f&fccid=25b377b3d374d9b2&vjs=3
IT Engineer (Remote - US),DISQO,Remote,30+ days ago,"If you have a proven track record of delivering such systems to internal customers, then this role is for you.",https://www.indeed.com/rc/clk?jk=33cd0e45907c7cfc&fccid=d1c06181f167b1a4&vjs=3
Sr. Lead Software Developer,S&P Global,"New York, NY",30+ days ago,"We are looking for a self-motivated, enthusiastic and passionate lead software developer to work on the next-generation real-time financial data web platform.",https://www.indeed.com/rc/clk?jk=f377db4d61a23034&fccid=b716e44d2c6283e7&vjs=3
"Sr. Systems Analyst, Testing",Kohler,"Kohler, WI",30+ days ago,"Lead end-to-end testing initiatives throughout the entire development process with a strong focus on performance testing, stress testing front end, back end…",https://www.indeed.com/rc/clk?jk=dc4683ea69f73689&fccid=c218388758b942e1&vjs=3
"Content developer, Digital",Tapestry,"New York, NY",30+ days ago,"Managerial Courage: Doesn’t hold back anything that needs to be said; provides current, direct, complete, and “actionable” positive and corrective feedback to…",https://www.indeed.com/rc/clk?jk=aae247fec17644c7&fccid=4b0e713ef50478fa&vjs=3
Full-Stack Developer - ProtoLAB,Baylor University,"Waco, TX",11 days ago,"Develop user interfaces, databases, and back-end applications. Experience using JavaScript frameworks (Node.JS, Angular JS, React, etc.), front-end Python…",https://www.indeed.com/rc/clk?jk=ca55bfb6cec7f8ce&fccid=b0759f3f30d5829c&vjs=3
Back End Software Developer,Firefly Aerospace,"Cedar Park, TX",29 days ago,"As a member of a startup organization, you’ll have the opportunity to truly drive the creation of data analytics platforms, enterprise resource planning systems…",https://www.indeed.com/company/Firefly-Aerospace/jobs/Back-End-Software-Developer-5b13125e913590f9?fccid=1a89f225d22439f1&vjs=3
Frontend Developer - ReactJS,"AmTote International, Inc.",United States,30+ days ago,JS Developer. You will be responsible for mostly front-end and some minor back end development using a combination of the latest tools and technologies to build…,https://www.indeed.com/rc/clk?jk=be79a2070081c4b0&fccid=6016b7b58f3df6ee&vjs=3
Front End Web Developer,Master Spas,"Fort Wayne, IN",8 days ago,Possess an in-depth understanding of HTML5 and CSS3. Basic understanding of CSS pre-processing platforms such as SASS. Have some experience utilizing Git.,"https://www.indeed.com/company/Master-Spas,-Inc./jobs/Front-End-Web-Developer-f53b8f5e62efccfb?fccid=b59b06bfc1b5d778&vjs=3"
