JobTitle,Company,Location,PostDate,Summary,JobUrl
"Software Engineer, Tanzu Observability - Opportunity for Working Remotely Phoenix, AZ",VMware Engineering,"Phoenix, AZ",30+ days ago,"We have flexibility during the day and for start and end times, with extra care to be flexible during the difficult times in which we find ourselves.",https://www.indeed.com/rc/clk?jk=335b884809f12a25&fccid=c762a27145bd166e&vjs=3
iOS App Developer,Xorbix Technologies Inc.,Remote,30+ days ago,Experience as a Native Android and iOS Developer and should have developed Applications from end to end. Proven work experience as a Mobile developer.,https://www.indeed.com/rc/clk?jk=582f8c9350c5ebdb&fccid=5bc2b79aaea8dcef&vjs=3
Software Developer (Intermediate),Vidyard,Remote,30+ days ago,"Learn from senior developers and tech leads while mentoring more junior developers. Modern front-end stacks - e.g. Webpack, Babel, Vue.js, React.js.",https://www.indeed.com/rc/clk?jk=7a0af3a4f1d1f010&fccid=481922bac21917d5&vjs=3
"Fullstack Software Developer, CRIT",Memorial Sloan-Kettering Cancer Center,"New York, NY",18 days ago,"Design and develop software covering the full stack (front-end and back-end.). Proficiency with front end languages such as React, Vue, etc.",https://www.indeed.com/rc/clk?jk=6965d0e8516e312a&fccid=1320c50b75f44505&vjs=3
"Senior full-stack developer, IBM Quantum Community, Remote work okay",IBM,"Yorktown Heights, NY",30+ days ago,"As a full-stack developer with a focus on back-end technologies, you have deep understanding of the Internet stack and service architectures, including micro…",https://www.indeed.com/rc/clk?jk=7f969737ef90c13d&fccid=de71a49b535e21cb&vjs=3
Application Developer (Back-End),Fox Corporation,"New York, NY",30+ days ago,"As an application developer, you will engage in the development of highly available cloud-based services, including API services, back end frameworks, and…",https://www.indeed.com/rc/clk?jk=6a321bb138804f47&fccid=61c19e057c54ec35&vjs=3
Software Engineer - All Levels - Remote,Reify Health,"Boston, MA",30+ days ago,"You delight in solving difficult problems, pay close attention to detail, and believe in the value of automation.",https://www.indeed.com/rc/clk?jk=1499c7b6221d5815&fccid=017db3ccccea4bb1&vjs=3
Senior Software Developer - Appointment Scheduling,Redfin,"Frisco, TX",30+ days ago,"Full-stack experience: 5+ years of experience as a software developer, working on both front and back-end features.",https://www.indeed.com/rc/clk?jk=4abfa0c3af603f58&fccid=ccaacd9cca9fffe8&vjs=3
MAGENTO DEVELOPER,Evience Development,"New York, NY",15 days ago,Performing a mix of front-end and back-end development on new and existing Magento sites. To develop front end for our Magento websites working alongside our…,https://www.indeed.com/rc/clk?jk=de279eb76470afb0&fccid=fa9802546c9128d8&vjs=3
Data Analyst,LogRocket,"Boston, MA",30+ days ago,"As a hyper data-driven organization, we have an increasing need to ensure we’re collecting, organizing and analyzing data across a variety of sales, marketing…",https://www.indeed.com/rc/clk?jk=f49fcfc49fac1967&fccid=13de75ca0ef07ac8&vjs=3
Developer Relations Engineer,LaunchDarkly,Remote,8 days ago,"You are a a skilled writer and a competent developer. Advocate for developer needs and experience, ensuring that community feedback is heard and brought to the…",https://www.indeed.com/rc/clk?jk=2b6bc1e30e7cc275&fccid=38096d3be8b39c07&vjs=3
"Software Developer, Staff","Fiserv, Inc.","Frisco, TX",30+ days ago,End-to-end working experience across the entire software development lifecycle. Experience as a software developer creating or maintaining core banking system…,https://www.indeed.com/rc/clk?jk=82c6e3488fe5ddda&fccid=1ea0475711674f3b&vjs=3
ServiceNow Developer,Sparibis,"Atlanta, GA",7 days ago,Work with key business stakeholders to identify needs and gaps between back-office platforms. The purpose of this position is to develop key automation of back…,https://www.indeed.com/rc/clk?jk=14d776cbc0c595de&fccid=cc2efaf09d344540&vjs=3
"Software Engineer (Mobile, Frontend)","Disney Parks, Experiences and Products","Glendale, CA",6 days ago,Deep knowledge of standards-based front and back end technologies. Able to code with front-end technology stack and lead end-to-end troubleshooting.,https://www.indeed.com/rc/clk?jk=79e7679ada6fdf39&fccid=6908893b5c7af08c&vjs=3
Web Developer,Telnet Inc,Virginia,9 days ago,Optimizing sites for maximum speed and scalability • Employing industry and design best practice through website build process • Conducting website testing •…,https://www.indeed.com/rc/clk?jk=ac8cb5f889314c53&fccid=5a62aae31819ee94&vjs=3
Senior Wordpress Developer - Remote |LATAM|,BairesDev,"Colon, PA",30+ days ago,Design and build back-end functionality including database and server integration. 5+ years of experience as a WordPress developer.,https://www.indeed.com/rc/clk?jk=ab168c944602a75f&fccid=29707109e86166e5&vjs=3
Multimedia/Conversational AI Developer-Work from home,Cigna,"Franklin Lakes, NJ",30+ days ago,"Expected to code in Java, not as UI but back end language, and code business logic in multi-tier environment. Devise and present solutions to larger audience to…",https://www.indeed.com/rc/clk?jk=428172f1ff7c4a19&fccid=afbf8c270610a38a&vjs=3
Full Stack Developer,BOEING,"Crystal City, VA",19 days ago,Work with the Product Owner and customer to design technical solutions and analytical capabilities against large quantities of raw intelligence as well as real…,https://www.indeed.com/rc/clk?jk=fb3e2de66688b78c&fccid=edae4285faf6c2f0&vjs=3
Senior Web Analytics Developer,Columbia Sportswear Company,"Beaverton, OR",30+ days ago,Guide end-users in identifying key performance indicators for their areas and then build appropriate reporting that provides insight into the performance of…,https://www.indeed.com/rc/clk?jk=9550f8bdd4446b64&fccid=e87d9cecd33775c9&vjs=3
Front-End Web Developer,Nasuni,"Boston, MA",9 days ago,Demonstrate an understanding of the entire web development process with back-end knowledge and best practices. Comfortable working in a fast-paced environment.,https://www.indeed.com/company/Nasuni/jobs/Front-End-Web-Developer-e0ec9fbdfab2108c?fccid=54bd58e9547515fc&vjs=3
Front End Web Developer,Samesurf,"Beverly Hills, CA",30+ days ago,"Specific expert experience required with (1) Photoshop and Illustrator; (2) back-end programming familiarity, including ASP.",https://www.indeed.com/rc/clk?jk=2f02c7818e31c5d0&fccid=b901dfde0b60cf39&vjs=3
Back-End Developer,Underwriters Laboratories Inc.,"Boulder, CO",30+ days ago,HOMER Grid is for optimizing grid-connected solar plus storage distributed generation systems. Develops and modifies complex information system programs.,https://www.indeed.com/rc/clk?jk=af0a7301ce092da4&fccid=353853af3b99ac74&vjs=3
Software Developer-Backend Service and Data,HP,"Vancouver, WA",5 days ago,"Designing, implementing, deploying and supporting back-end microservices (SpringBoot). In this role, you will work with other software developers, data…",https://www.indeed.com/rc/clk?jk=ab410879d5b256ac&fccid=1b866506aec22461&vjs=3
Application Support Analyst - Manufacturing Quality,Tesla,"Fremont, CA",30+ days ago,"Launch systems and tools to new departments, manufacturing lines and global factories and train new stakeholders• Work directly with software developers to…",https://www.indeed.com/rc/clk?jk=ff52a451c8f4ec01&fccid=86e9be6ce380173e&vjs=3
Senior iOS App Developer,Noxsolutions.com,Remote,30+ days ago,Knowledgeable in consuming RESTful APIs to connect iOS applications to back-end services. 5+ years of experience as an iOS developer.,https://www.indeed.com/rc/clk?jk=2478af3cf7e39b22&fccid=6cd80bea00f0e9e3&vjs=3
Applications Developer (TS/SCI with Polygraph required),CACI,"Dulles, VA",21 days ago,"Experience with front-end and/or back-end development. As the successful Applications Developer, you will develop the software features provided by the…",https://www.indeed.com/rc/clk?jk=b08b56873dd1d41e&fccid=290a4498a64fc044&vjs=3
Front End Developer - HTML/CSS/JavaScript - Mid-level to Senior,Gantzer Group,"Cleveland, OH",30+ days ago,"Small team environment working with 5 other front and back end developers, along with other designers and project managers. Employment Type Full Time, On-Site.",https://www.indeed.com/rc/clk?jk=22f5ac1c96927b5f&fccid=7bca306dbaa8703d&vjs=3
Back-End Developer,BankUnited,"Miami, FL",30+ days ago,"Minimum 5 years of experience developing in back-end Java. Work closely with the product owner, other developers and QA engineers to shape the product.",https://www.indeed.com/rc/clk?jk=ba806b15c880d692&fccid=5500c50eab3ba786&vjs=3
VP of Engineering,OutSystems,Remote,30+ days ago,You have the ability to roll up your sleeves and help the team solve tough technical issues while being a motivational leader that fosters decentralized…,https://www.indeed.com/rc/clk?jk=176be8464df4e9a6&fccid=2d27a79a723f85a0&vjs=3
VP of Engineering,OutSystems,Remote,30+ days ago,You have the ability to roll up your sleeves and help the team solve tough technical issues while being a motivational leader that fosters decentralized…,https://www.indeed.com/rc/clk?jk=176be8464df4e9a6&fccid=2d27a79a723f85a0&vjs=3
"Senior Applications Developer, Personalization",Mast Global,"Reynoldsburg, OH",30+ days ago,7-10 years of experience developing scalable back end solutions. The successful candidate will be a seasoned technologist with a proven track record in…,https://www.indeed.com/rc/clk?jk=57ae7d3a9d9557d6&fccid=484c4140fe790932&vjs=3
Software Engineer II,Upland Software,Remote,13 days ago,A successful candidate will be able to quickly scale up into a SPA front-end and Ruby on Rails back end. Work with support team to fix any bugs that arise in…,https://www.indeed.com/company/Upland-Software/jobs/Software-Engineer-23ffb3669f806c2e?fccid=b29545c1d183062e&vjs=3
Python (Django/Flask) Back-End Developer: Consultant,Deloitte,"Austin, TX",30+ days ago,"Our Government and Public Services Strategy and Analytics team brings deep industry expertise, rigorous analytical capabilities and a pragmatic mindset to help…",https://www.indeed.com/rc/clk?jk=93f53f4701b3eb25&fccid=9e215d88a6b33622&vjs=3
Banner Developer | REMOTE JOB,iknowvate technologies,"Baltimore, MD",30+ days ago,Design & develop enterprise back-end database applications based on requirements and under the guidance of SMEs and Systems Architect.,https://www.indeed.com/rc/clk?jk=e0cd961b8b2a774f&fccid=9ace5aa4e4fa6ce2&vjs=3
Software Developer Java/Microservices/BigData/Machine Learning,General Motors,Michigan,5 days ago,Create software for vehicle level functions and perform integration and verification testing with minimal direction of lead engineers.,https://www.indeed.com/rc/clk?jk=3b287c491a50fd8f&fccid=116680a29a847a70&vjs=3
Full Stack Developer,Prevail Legal,"San Francisco Bay Area, CA",13 days ago,Build end to end solutions with minimum coupling. Minimum 3+ years of Ruby on Rails experience. Minimum 3+ years of JavaScript(ES6) experience.,https://www.indeed.com/rc/clk?jk=eaf5a50a9c3fce7c&fccid=a1a8cba8f648fe77&vjs=3
Senior Database Developer,"JRC Integrated Systems, Inc.","Dahlgren, VA",30+ days ago,"Applies knowledge and experience with database technologies, development methodologies, and front-end (e.g., Cognos)/back-end programming languages (e.g., SQL).",https://www.indeed.com/rc/clk?jk=97331b67845e4c1b&fccid=83343ac70bf76dc4&vjs=3
Back End Engineer- Remote,Divisions Maintenance Group,"Newport, KY",30+ days ago,"They understand the importance of performance and work to ensure that queries execute as quickly as possible, and that server resources are not overwhelmed.",https://www.indeed.com/rc/clk?jk=94a2e9e200199bb8&fccid=883791e2fe8d9b3e&vjs=3
Full Stack Software Developer,NPR,"Washington, DC",8 days ago,"Mastery of native JavaScript, with experience using Node.js and any front end frameworks such as AngularJS, Vue, React, etc.",https://www.indeed.com/rc/clk?jk=fe4a6ea701517d30&fccid=15d9afdbc1e1cdf0&vjs=3
Python Developer,IMS,"Allen, TX",6 days ago,"These systems range from back-end integrations to command-line utilities to web-based user interfaces. JavaScript (or TypeScript), HTML5, other front-end…",https://www.indeed.com/rc/clk?jk=bd27bdb8b80ed55d&fccid=c6f1c98fe5b82d26&vjs=3
Early Career Mobile Developer - Android,Saviance,United States,30+ days ago,"Familiarity with RESTful APIs to connect Android applications to back-end services. Design, build, and maintain high performance, reusable, and reliable Android…",https://www.indeed.com/rc/clk?jk=daa1a79d377f840d&fccid=26b7e7f07a55840f&vjs=3
Frontend Developer - ReactJS,Xpressbet,United States,30+ days ago,JS Developer. You will be responsible for mostly front-end and some minor back end development using a combination of the latest tools and technologies to build…,https://www.indeed.com/rc/clk?jk=4be08ad22eb44343&fccid=91511007d9ce876d&vjs=3
Back End Developer,Booz Allen Hamilton,"McLean, VA",18 days ago,"You need the right combination of clean code, APIs, analytics, and infrastructure to build a user focused solution. Experience with Source Control Tools (Git).",https://www.indeed.com/rc/clk?jk=96efaf5bad43dba6&fccid=4e041af1d0af1bc8&vjs=3
Senior Software Developer - Home Discovery,Redfin,"San Francisco, CA",30+ days ago,"You will have the opportunity to build services that scale to millions of users, improve website performance, and create beautiful customer-facing UI.",https://www.indeed.com/rc/clk?jk=972cab28e6a214cf&fccid=ccaacd9cca9fffe8&vjs=3
Salesforce Marketing Cloud Developer,Dell Technologies,"Florida, MA",15 days ago,"As a Software Principal Engineer, you will be responsible for developing sophisticated systems and software basis the customer’s business goals, needs and…",https://www.indeed.com/rc/clk?jk=1c4412108f43f4e9&fccid=dd09fe3b43125016&vjs=3
Developer - Front End,Logic20/20,"Los Angeles, CA",18 days ago,"Willingness to lead projects from concept to delivery by working closely with back-end and front-end developers. Strong proficiency with JavaScript, Node.",https://www.indeed.com/rc/clk?jk=fde4c90898fc4a35&fccid=e2f8d6934fd95c43&vjs=3
WordPress Developer PHP,Gateway Blend,"St. Louis, MO",19 days ago,"Strong understanding of PHP back-end development. The top skills needed are PHP (PhpStorm), Wordpress, Git, MySQL, and front-end technologies including CSS3,…",https://www.indeed.com/rc/clk?jk=644a4f56394e41a4&fccid=3fc31fcc944002f3&vjs=3
Senior Web Application Developer,DuxWare,"Slidell, LA",30+ days ago,Medical Practice Software Inc. is seeking a Full-Time Senior Web Application Developer with at least two years of experience who will be responsible for the…,https://www.indeed.com/rc/clk?jk=b3a9e18a74cb789a&fccid=6ea54858cdc2c2fc&vjs=3
Help Desk Analyst,ASRC Federal Holding Company,"Fort Collins, CO",30+ days ago,"Log incoming calls into the Call Tracking System (presently ServiceNow), dispatching them to the appropriate personnel for resolution, and following up with…",https://www.indeed.com/rc/clk?jk=48fdde532b68115b&fccid=adbb342bd2008a4b&vjs=3
Android developer,BosLeo,"Newbury Park, CA",30+ days ago,"Translate designs and wireframes into high quality code. Should have experience in JUnit, Mockito. Design, build, and maintain high performance, reusable, and…",https://www.indeed.com/rc/clk?jk=5b1c2b493af0bc88&fccid=b30d99fbc42689df&vjs=3
GPSC Full Stack Senior Developer,General Motors,"Roswell, GA",1 day ago,"Automates unit/end-to-end testing of software systems within their domain, focused on software quality and maintainability.",https://www.indeed.com/rc/clk?jk=dddeadd1ec6a0626&fccid=116680a29a847a70&vjs=3
ETL Application Developer (**REMOTE AVAILABLE**),Vanderbilt University Medical Center,"Nashville, TN",30+ days ago,Occasional: Bending/Stooping: Trunk bending downward and forward by bending spine at waist requiring full use of lower extremities and back muscles.,https://www.indeed.com/rc/clk?jk=ff8b74d86be40a13&fccid=9a79b8527fbd5a84&vjs=3
Front End Developer,Adage Technologies,"Chicago, IL",30+ days ago,"Maintaining and improving front-end code bases across a wide variety of projects. Building semantic, accessible and maintainable front-end interfaces with HTML5…",https://www.indeed.com/rc/clk?jk=066665ba964df41d&fccid=6bf82ef7d0c87db2&vjs=3
"Senior Back-end Software Developer - Raleigh, NC",IBM,"Research Triangle Park, NC",6 days ago,"Software Developers at IBM are the backbone of our strategic initiatives to design, code, test, and provide industry-leading solutions that make the world run…",https://www.indeed.com/rc/clk?jk=b316d2a49a143cea&fccid=de71a49b535e21cb&vjs=3
Software Design/Development Engineer,General Motors,Michigan,28 days ago,This is in support of the company’s Computer Aided Engineering (CAE) Application teams that perform end-to-end simulations from vehicle design through vehicle…,https://www.indeed.com/rc/clk?jk=7aa73441dcfb040a&fccid=116680a29a847a70&vjs=3
"Fullstack Software Developer, CRIT",Memorial Sloan-Kettering Cancer Center,"New York, NY",18 days ago,"Design and develop software covering the full stack (front-end and back-end.). Proficiency with front end languages such as React, Vue, etc.",https://www.indeed.com/rc/clk?jk=6965d0e8516e312a&fccid=1320c50b75f44505&vjs=3
Web Developer,Gospel for Asia (GFA),"Wills Point, TX",30+ days ago,"Integrates front-end user interfaces with back-end applications and our content management system. We will provide training, guidance, and coaching in how to…",https://www.indeed.com/rc/clk?jk=5f78aca6923eaf28&fccid=79a0ff573117f598&vjs=3
Full Stack Development Coordinator,iMMAP,Remote,27 days ago,"Develop front-end’s architecture and platforms back-end. Proficiency with fundamental front end languages such as HTML, CSS and JavaScript.",https://www.indeed.com/rc/clk?jk=8ae9cdaeec23eaef&fccid=2f089935c708df33&vjs=3
Software Engineer,Highspot,"Seattle, WA",15 days ago,"Highspot helps sales teams improve customer conversations and achieve their revenue goals. Using Highspot, marketing leaders have deep insights and analytics…",https://www.indeed.com/rc/clk?jk=ca2aaf8c3440633e&fccid=fecd220976785cb1&vjs=3
Senior .NET Developer,HotSchedules,"Sofia, NM",30+ days ago,"You will be responsible for developing the software applications of Fourth including technical documentation, participating in new feature development, bug…",https://www.indeed.com/rc/clk?jk=5ff177b96c8748f7&fccid=49d86eba2fe6034f&vjs=3
Web Developer,Live Nation,"Beverly Hills, CA",30+ days ago,Develop and integrate front-end and back-end functionality for web applications. This role will be responsible for working with other developers and product…,https://www.indeed.com/rc/clk?jk=4fc66de13060017f&fccid=f2d0ffe36bb2f0f4&vjs=3
"Senior Program Architect, Health Insurance",Salesforce,Arizona,5 days ago,"Ability to work independently and be a self-starter in one or more of the following domains: front- and back-end solution architecture, web/mobile solutions,…",https://www.indeed.com/rc/clk?jk=a5cbb9e82d1830f1&fccid=4027cfd917e1ee29&vjs=3
"Backend Developer, Senior",Booz Allen Hamilton,"Alexandria, VA",14 days ago,"As a back-end developer on our team, you’ll learn how to help customers overcome their most difficult challenges using modern agile practices and a modern…",https://www.indeed.com/rc/clk?jk=c9f32cbf440b9f15&fccid=4e041af1d0af1bc8&vjs=3
Full Stack Developer,Booz Allen Hamilton,"Arlington, VA",28 days ago,"2+ years of experience with Python for back-end. You need the right combination of clean code, APIs, analytics, and infrastructure to build a user focused…",https://www.indeed.com/rc/clk?jk=de72ea0131c51509&fccid=4e041af1d0af1bc8&vjs=3
Front-End Developer,"The Restaurant Store, Inc.","Tampa, FL",30+ days ago,"Assisting back-end developers with troubleshooting site bugs, or markup implementation. Write semantic, and accessible HTML.",https://www.indeed.com/rc/clk?jk=95d12e94bc7a48df&fccid=15c26b2f7c7309c1&vjs=3
Senior Back-end Engineer,Grove Collaborative,"Durham, NC",30+ days ago,"Help derisk deploys, decouple software entities, and improve the overall developer experience. Each month, millions of customers use our web and native apps …",https://www.indeed.com/rc/clk?jk=da23c040d2b42334&fccid=9ee7581ae7baf7fe&vjs=3
Software Engineer -Back End Developer,Q2ebanking,"Lincoln, NE",30+ days ago,"Our API and Back-end Systems are built using . You will help plan, design, develop, test, and debug, highly available/scalable applications and services.",https://www.indeed.com/rc/clk?jk=9114792048236213&fccid=5cf515b6d3e65482&vjs=3
Front End Developer,Ritchie Bros.,United States,12 days ago,"Collaborate with architects, front-end developers, and back-end developers in conceptualizing and developing high-performing web systems.",https://www.indeed.com/rc/clk?jk=8ce2d04d2f93c095&fccid=143c7479acc5b806&vjs=3
Senior PHP Developer,ATIBA,"Nashville, TN",30+ days ago,"Regardless of the project, our Sr. Developers make decisions that greatly impact the architecture and workflow of the code. Can import/export data sets.",https://www.indeed.com/rc/clk?jk=62dceab5aee27878&fccid=6e535d6f86782429&vjs=3
Distributed Application Developer,Karen Clark & Company,"Boston, MA",30+ days ago,"In this position, you will work closely with the Software Development Team to develop and implement solutions to optimize platform components, assist with…",https://www.indeed.com/rc/clk?jk=d9bd025a5c89f29d&fccid=afd7dfce0c0eeccb&vjs=3
MySQL Database Administrator,Cornerstone Defense,"Chantilly, VA",5 days ago,"Provide timely database support to developers, testers, power users and end users. Develop technical designs, documentation, requirements and collaborate with…",https://www.indeed.com/rc/clk?jk=33d3923695f1ef18&fccid=c4dad3c95358e466&vjs=3
"Engineer, Kabbage Data Connections",American Express,"Atlanta, GA",30+ days ago,"Lead by example and mentor developers in all aspects of planning, development and testing. Comfortable with at least one modern front-end framework and can…",https://www.indeed.com/rc/clk?jk=8377e88363a4bbe8&fccid=f057e04c37cca134&vjs=3
IT Project Coordinator,Stanford University,"Redwood City, CA",30+ days ago,"Under general supervision, this position also supports IT quality assurance and the end users of various application systems as needed by being an effective…",https://www.indeed.com/rc/clk?jk=49ab8f3ca434d5f3&fccid=1ba7f338730ce720&vjs=3
Backend Cloud Developer,NS804,Virginia,30+ days ago,Proven work experience as a Back-end developer. Collaborate with Front-end developers to integrate user-facing elements with server side logic.,https://www.indeed.com/rc/clk?jk=96517b8f4d9c4ea1&fccid=15aaf27a53b4b95a&vjs=3
Back End Developer- Digital,Archer Daniels Midland Company,"Erlanger, KY",30+ days ago,5+ years of demonstrated ability in back-end development. Responsible to transfer the back-end solution once MVP is done. Write the web services and APIs.,https://www.indeed.com/rc/clk?jk=9cdca7cb3bde5462&fccid=a46683ec51ead49e&vjs=3
Salesforce Developer,Accenture,"New York, NY",6 days ago,"Typical Force.com implementations include custom platform development (Apex, Visualforce, Lightning Components, front end web technologies), integrations with…",https://www.indeed.com/rc/clk?jk=ae3140f1a097c852&fccid=a4e4e2eaf26690c9&vjs=3
"Full Stack Developer, Mid",Booz Allen Hamilton,"Washington, DC",Today,"We need an experienced back-end developer who will use their passion to guide a development team to learn new tools and techniques, identify and implement…",https://www.indeed.com/rc/clk?jk=630dd850889f4046&fccid=4e041af1d0af1bc8&vjs=3
iOS Developer,Nine Zeros Entertainment,"Los Angeles, CA",30+ days ago,"As iOS developer you’ll work collaboratively with other developers and designers on architecture, design, and implementation, while focusing on implementation…",https://www.indeed.com/rc/clk?jk=25d3b57263fcaaac&fccid=70ca24183a5fd27c&vjs=3
Sr. Java Developer,Involve I.T. Inc,"Minneapolis, MN",30+ days ago,"Stronger more on the back-end (the standard…spring, etc.). Additionally, somebody who can write SQL and Stored Procedures - not necessarily doing database…",https://www.indeed.com/rc/clk?jk=d950d5508c483503&fccid=5189acebfaa5c9a2&vjs=3
Frontend Software Engineer,"Zoom Video Communications, Inc.","Seattle, WA",30+ days ago,"Knowledge of web back end such as Java programming, Spring, MySql, Redis. In this role, you will utilize your knowledge of application programming to extend the…",https://www.indeed.com/rc/clk?jk=9c55202543a233e5&fccid=e32d933c26e873c8&vjs=3
Application Support Specialist II,Burlington Stores,"Edgewater Park, NJ",Just posted,"This person will support end users using their analytical, organizational and technical skills. Act as a liaison between application developer and the customer…",https://www.indeed.com/rc/clk?jk=e59c592a965af8ab&fccid=aa2fd58d0ae65364&vjs=3
Sr Back End Developer,Aspen Technology,"Bedford, MA",30+ days ago,"Collaborate with customers, product managers, designers and developers to understand customer needs and translate them into product requirements and…",https://www.indeed.com/rc/clk?jk=78e2a8e02a39b6a6&fccid=b3fc015a7c99e39b&vjs=3
Web Application Developer Sr.,Arizona State University,"Tempe, AZ",6 days ago,Experience with databases and back-end development. Experience in communicating with stakeholders and end-users. Preference will be given to those who present:,https://www.indeed.com/rc/clk?jk=f7c572ce5be4faec&fccid=b97aa9a98af93bad&vjs=3
